signature_pattern,match_type,apt_group,malware_family,severity,first_seen,description,reference
*Mimikatz*,wildcard,APT33|APT34|APT39|MuddyWater,Mimikatz,critical,2013,Credential harvesting tool - all Iranian APTs. APT39 uses modified variants.,MITRE T1003.001
*LaZagne*,wildcard,APT33|APT34|APT35|MuddyWater,LaZagne,critical,2017,Open-source credential recovery tool.,Trellix 2024
*Empire*,wildcard,APT33|MuddyWater,Empire,high,2016,PowerShell Empire post-exploitation framework.,MITRE G0064/G0069
*POWERSTATS*,wildcard,MuddyWater,POWERSTATS,critical,2017,MuddyWater first-generation PowerShell backdoor.,Trend Micro 2019
*Shamoon*,wildcard,APT33|APT35,Shamoon/DistTrack,critical,2012,Destructive disk wiper. Used by APT35 (2012) then APT33 (2017).,McAfee 2018
*StoneDrill*,wildcard,APT33,StoneDrill,critical,2017,Destructive wiper with anti-emulation. Deployed via DROPSHOT dropper.,Kaspersky 2017
*Hacktool*,wildcard,APT33|APT34|APT39|MuddyWater,Various Hacktools,high,2014,Generic hacktool detections - correlate with other indicators.,Generic
*Tidyelf*,wildcard,APT33,TURNEDUP,critical,2016,APT33 TURNEDUP custom backdoor.,MITRE G0064
*FalseFont*,wildcard,APT33,FalseFont,critical,2023,APT33 custom backdoor targeting defense industrial base.,Microsoft 2023
*Tickler*,wildcard,APT33,Tickler,critical,2024,APT33 multi-stage C/C++ backdoor. Uses .pdf.exe double extension. Persists via Run key as SharePoint.exe.,Microsoft 2024
*POWERTON*,wildcard,APT33,POWERTON,critical,2018,APT33 PowerShell-based modular backdoor.,FireEye 2018
*TURNEDUP*,wildcard,APT33,TURNEDUP,critical,2016,APT33 long-standing custom backdoor.,MITRE G0064
*DROPSHOT*,wildcard,APT33,DROPSHOT,critical,2017,APT33 dropper for SHAPESHIFT/StoneDrill wipers.,MITRE G0064
*SHAPESHIFT*,wildcard,APT33,SHAPESHIFT,critical,2017,Destructive wiper with in-memory injection. Anti-emulation.,MITRE G0064
*SideTwist*,wildcard,APT34,SideTwist,critical,2021,APT34 native backdoor. File upload/download and remote shell.,MITRE G0049
*Saitama*,wildcard,APT34,Saitama,critical,2022,APT34 DNS tunnelling implant using FSM architecture. A/AAAA/TXT records.,MITRE G0049
*BONDUPDATER*,wildcard,APT34,BONDUPDATER,high,2017,APT34 DNS-based downloader.,FireEye 2017; Booz Allen 2018
*POWRUNER*,wildcard,APT34,POWRUNER,high,2017,APT34 PowerShell-based backdoor.,FireEye 2017
*PowerExchange*,wildcard,APT34,PowerExchange,critical,2023,APT34 Exchange server backdoor using email as C2 channel.,Fortinet 2023
*STEALHOOK*,wildcard,APT34,STEALHOOK,critical,2024,APT34 Exchange-based exfiltration tool.,Picus 2025
*Veaty*,wildcard,APT34,Veaty,critical,2024,APT34 .NET backdoor using XML config with base64 encoding. Email-based C2.,CYFIRMA Q3 2024
*Spearal*,wildcard,APT34,Spearal,critical,2024,APT34 .NET backdoor communicating via DNS tunnelling (Base32).,CYFIRMA Q3 2024
*BugSleep*,wildcard,MuddyWater,BugSleep,critical,2024,"MuddyWater custom backdoor with sandbox evasion (Sleep API), DLL injection prevention.",CheckPoint 2024
*PowGoop*,wildcard,MuddyWater,PowGoop,critical,2022,MuddyWater DLL side-loading loader impersonating Google Update.,USCYBERCOM 2022
*Small Sieve*,wildcard,MuddyWater,Small Sieve,high,2022,MuddyWater lightweight backdoor.,NCSC GCHQ 2022
*Phoenix*Backdoor*,wildcard,MuddyWater,Phoenix,critical,2025,MuddyWater lightweight implant via FakeUpdate injector. Winlogon persistence.,Group-IB Oct 2025
*Charming*Kitten*,wildcard,APT35,Various,high,2014,Generic Charming Kitten tool detections.,ClearSky
*Remexi*,wildcard,APT39,Remexi,high,2015,APT39/Chafer surveillance backdoor.,Kaspersky 2019
*Cadelspy*,wildcard,APT39,Cadelspy,high,2015,APT39 data collection and surveillance tool.,Symantec 2015
*FRP*,wildcard,APT35|MuddyWater,Fast Reverse Proxy,high,2019,Open-source FRP tool used for tunnelling by APT35 and MuddyWater.,Trellix 2024
*DCHSpy*,wildcard,MuddyWater,DCHSpy,critical,2025,MuddyWater mobile spyware leveraged during Israel-Iran conflict.,Lookout 2025
